,job_title,organization,min_salary,max_salary,location,job_description,job_type
16,"Software & System Test Engineer (Lead, Automation & AI-Driven QA)",CHAOS Industries,"$145,000","$250,000","Hawthorne, California, United States","CHAOS Inc. is a global technology company delivering next-generation capabilities to the defense and critical industrial sectors. Founded in 2022 by a seasoned leadership team, CHAOS has quickly become the place where world-class multi-disciplinary engineers come to build mission-critical technologies. CHAOS has a mission-focused culture, dedicated to solving the toughest technical challenges. Its unique agile engineering approach enables rapid prototyping, while deep partnerships with defense and industry ensure real-world solutions. Role Overview CHAOS is seeking a Lead Software Test Engineer to build and lead our automated system testing capability. This is a foundational role - an opportunity to define strategy and hands-on implement system & software testing across CHAOS’s cutting-edge sensing systems. You will collaborate closely with systems engineering and software engineering teams to create a robust automated test & validation pipeline that’s integrated into our CI/CD and release process. You’ll build tools, implement automated system tests, and develop rich reporting & analytics to ensure CHAOS's products meet the critical needs and requirements of our customers. The ideal candidate is a problem solver and innovator, fluent in both software quality and AI-assisted test & development, who will shape how CHAOS validates the next generation of defense technologies. Responsibilities Establish and lead the automated software testing group within CHAOS, working with a distributed set of teams across multiple products. Fully integrate Hardware-in-the-loop automated testing for production HW across multiple products and variants Collaborate with systems and software engineers to validate system-level and mission-level functionality Design, develop, and maintain end-to-end test frameworks for SW & FW Development (e.g. Python, CUDA, Typescript, and FPGA code) Fully integrate into CI/CD pipelines (Bitbucket, Jenkins, Azure) for continuous test execution and analysis Support development and V&V for system test automation Build automated reporting and coverage dashboards, including AI-driven summarization of test incidents and anomalies Leverage AI to build and apply a suite of radar domain-specific automated test and validation capabilities Develop AI-native workflows using code copilots, LLMs, and reasoning models for intelligent automated system test Mentor junior engineers as the test organization scales Work on-site at our office in Hawthorne, CA Minimum Requirements 5+ years of experience in software QA, automated testing, or related software engineering roles Strong experience with Python and modern automated testing frameworks (pytest, robot framework, Playwright, or similar) Experience integrating tests into CI/CD environments and measuring code coverage Familiarity with Dockerized or cloud-deployed software (Azure experience preferred) Experience with AI-native development tools applied to automated test (GitHub Copilot, OpenAI APIs, Claude Code, or similar). Experience building automated test frameworks for data pipelines, Hardware-in-the-loop system testing, and/or or real-time systems Demonstrated ability to work cross-functionally with systems and software teams Preferred Requirements Familiarity with defense-related sensing domains such as radar, RF/IQ data processing, and/or sensor fusion Understanding of performance testing, fault injection, and simulation-based testing (HIL/SIL) Proficiency with Git and agile development practices Experience designing workflows for large-scale regression, fuzz, or stress testing Why CHAOS? Health Benefits: Your medical, dental and vision benefits will be 100% paid for by the company Additional benefits : life, FSA, HSA, 401k (+ Company match), and more Our Perks: free daily lunch, ‘No meeting Fridays’, unlimited PTO, casual dress code Compensation Components: competitive base salaries, generous pre-IPO stock option grants, relocation assistance + (coming soon!) annual bonuses Company Size: 150 employees and counting! More About Us: We're building the next generation of aerospace, defense and critical industry technologies with a seasoned team of mission-focused individuals. We were founded in June 2022 and our goal is to become the platform where world-class engineers come to solve critical, real-world problems. We use agile engineering approaches which enable rapid prototyping, deep partnerships with the defense industry ensuring real-world application, and our newly-invented Coherence platform (through which we’ve made a fundamental breakthrough) improves sensor performance and decision-making in real-time. As of April 2025 we have raised $490M (including a $275M Series C at a $2B valuation) from some of the most prominent VC funds and investors including Accel, NEA, 8VC, and Valar. With a managing team that includes Epirus’ founding members (responsible for building a $1.5B company from scratch) + key drivers from Palantir (instrumental in Palantir’s growth to $1B in revenue), we are well-positioned to become one of the fastest growing companies to date! Salary Range: $145,000 - $250,000 The stated compensation range reflects only the targeted base compensation range and excludes additional earnings such as bonus, equity, and benefits. If your compensation requirements fall outside of the range, we still encourage you to apply. The salary range for this role is an estimate based on a range of compensation factors, inclusive of base salary only. Actual salary offer may vary based on (but not limited to) work experience, education and/or training, critical skills, and/or business considerations. #LI-onsite",Full Time
17,Staff Machine Learning Engineer - Acquisition Paid Search,StubHub,"$300,000","$350,000","New York, United States","StubHub is on a mission to redefine the live event experience on a global scale. Whether someone is looking to attend their first event or their hundredth, we’re here to delight them all the way from the moment they start looking for a ticket until they step through the gate. The same goes for our sellers. From fans selling a single ticket to the promoters of a worldwide stadium tour, we want StubHub to be the safest, most convenient way to offer a ticket to the millions of fans who browse our platform around the world. About the Opportunity We’re seeking a Staff Machine Learning Engineer to lead the science and systems that power our paid search marketing. You’ll design the causal measurement stack, ship models that influence bidding and budgeting in real time, and partner with marketing, data, and platform teams to drive profitable, incremental growth. StubHub is the largest secondary ticket market in the world, generating massive amounts of consumer data that are leveraged to tackle many unique and interesting predictive and inference problems across user acquisition, product recommendations, pricing optimization, ticket fulfillment mitigation, and business forecasting. The core challenge for our marketing efforts is acquire as many new customers as possible, efficiently, and at the right time in their customer journey, making it a complex and highly impactful domain. Location: Hybrid (3 days in office/2 days remote) – New York, NY or Los Angeles, CA What You'll Do: Own causal measurement for paid search : Stand up uplift/incrementality frameworks (e.g., doubly robust learners, causal forests, DML, IVs, synthetic control, DiD, BSTS) to quantify lift beyond correlation. Ship production models : Build and serve models that inform bids, budgets, and query-level targeting using signals like incremental CPA, tROAS, LTV, and heterogenous treatment effects. Design experiments & guardrails : Architect geo/cell tests and online experiments; handle power analysis, pre-trend checks, SUTVA threats, SRM detection, and sequential monitoring. Integrate with ad platforms : Translate science into APIs/feeds for Google Ads, Microsoft Advertising, and SA360; validate against auction dynamics and Quality Score mechanics. Data & MLOps leadership : Partner with platform teams to instrument events, build reliable feature stores and ETL (batch/stream), and establish monitoring for drift, bias, leakage, and attribution sanity. Mentor & influence : Provide technical leadership across science, engineering, and marketing; set standards for methodology, code quality, documentation, and reproducibility. Tell the story : Communicate trade-offs and impact to execs and non-technical partners; make the complex understandable and actionable. What You've Done: 8+ years in applied ML/causal inference (or equivalent) with direct paid search/auction experience. Expert in causal methods (uplift modeling, DML, IV, DiD/synth control, BSTS/Bayesian time series) and experimental design . Strong software engineering: Python (pandas, numpy, scikit-learn, LightGBM/XGBoost), SQL; experience with Spark and one of AWS/GCP/Azure. Hands-on with A/B frameworks , power analysis, and measurement diagnostics (SRM, balance, interference). Proven track record integrating with Google Ads/Microsoft Ads/SA360 and moving the needle on tROAS, CPA, LTV. Clear communicator who can mentor senior ICs and partner with product/marketing. Nice to Have: Recsys, bandits/RL for bidding/budget pacing, MMM and privacy-aware attribution Scala/Java or microservices experience; Airflow/DBT; Kafka/PubSub; Feast or similar feature stores. Domain knowledge of auction theory, query taxonomy, brand vs. non-brand dynamics, and budget rebalancing Staff-Level Capabilities Technical leadership through influence rather than formal management authority Strategic thinking with the ability to balance long-term technical vision with immediate organizational needs Cross-functional collaboration skills to work effectively with Data Science, Product, and Engineering teams Communication skills to inject technical context into high-level organizational discussions Problem-solving approach for ambiguous, high-impact technical challenges Mentorship and sponsorship experience growing junior and mid-level engineers What We Offer: Accelerated Growth Environment: Immerse yourself in an environment designed for swift skill and knowledge enhancement, where you have the autonomy to lead experiments and tests on a massive scale. Top Tier Compensation Package: Enjoy a rewarding compensation package that includes enticing stock incentives, aligning with our commitment to recognizing and valuing your contributions. Flexible Time Off: Embrace a healthy work-life balance with unlimited Flex Time Off, providing you the flexibility to manage your schedule and recharge as needed. Comprehensive Benefits Package: Prioritize your well-being with a comprehensive benefits package, featuring 401k, and premium Health, Vision, and Dental Insurance options. The anticipated gross base pay range is below for this role. Actual compensation will vary depending on factors such as a candidate’s qualifications, skills, experience, and competencies. Base annual salary is one component of StubHub’s total compensation and competitive benefits package, which includes equity, 401(k), paid time off, paid parental leave, and comprehensive health benefits. Salary Range $300,000 - $350,000 USD About Us StubHub is the world’s leading marketplace to buy and sell tickets to any live event, anywhere. Through StubHub in North America and viagogo, our international platform, we service customers in 195 countries in 33 languages and 49 available currencies. With more than 300 million tickets available annually on our platform to events around the world -- from sports to music, comedy to dance, festivals to theater -- StubHub offers the safest, most convenient way to buy or sell tickets to the most memorable live experiences. Come join our team for a front-row seat to the action. For California Residents: California Job Applicant Privacy Notice found here We are an equal opportunity employer and value diversity on our team. We do not discriminate on the basis of race, color, religion, sex, national origin, gender, sexual orientation, age, disability, veteran status, or any other legally protected status.",Full Time
18,Staff Machine Learning Engineer - Acquisition Paid Search,StubHub,"$300,000","$350,000","Aliso Viejo, California, United States","StubHub is on a mission to redefine the live event experience on a global scale. Whether someone is looking to attend their first event or their hundredth, we’re here to delight them all the way from the moment they start looking for a ticket until they step through the gate. The same goes for our sellers. From fans selling a single ticket to the promoters of a worldwide stadium tour, we want StubHub to be the safest, most convenient way to offer a ticket to the millions of fans who browse our platform around the world. About the Opportunity We’re seeking a Staff Machine Learning Engineer to lead the science and systems that power our paid search marketing. You’ll design the causal measurement stack, ship models that influence bidding and budgeting in real time, and partner with marketing, data, and platform teams to drive profitable, incremental growth. StubHub is the largest secondary ticket market in the world, generating massive amounts of consumer data that are leveraged to tackle many unique and interesting predictive and inference problems across user acquisition, product recommendations, pricing optimization, ticket fulfillment mitigation, and business forecasting. The core challenge for our marketing efforts is acquire as many new customers as possible, efficiently, and at the right time in their customer journey, making it a complex and highly impactful domain. Location: Hybrid (3 days in office/2 days remote) – New York, NY or Los Angeles, CA What You'll Do: Own causal measurement for paid search : Stand up uplift/incrementality frameworks (e.g., doubly robust learners, causal forests, DML, IVs, synthetic control, DiD, BSTS) to quantify lift beyond correlation. Ship production models : Build and serve models that inform bids, budgets, and query-level targeting using signals like incremental CPA, tROAS, LTV, and heterogenous treatment effects. Design experiments & guardrails : Architect geo/cell tests and online experiments; handle power analysis, pre-trend checks, SUTVA threats, SRM detection, and sequential monitoring. Integrate with ad platforms : Translate science into APIs/feeds for Google Ads, Microsoft Advertising, and SA360; validate against auction dynamics and Quality Score mechanics. Data & MLOps leadership : Partner with platform teams to instrument events, build reliable feature stores and ETL (batch/stream), and establish monitoring for drift, bias, leakage, and attribution sanity. Mentor & influence : Provide technical leadership across science, engineering, and marketing; set standards for methodology, code quality, documentation, and reproducibility. Tell the story : Communicate trade-offs and impact to execs and non-technical partners; make the complex understandable and actionable. What You've Done: 8+ years in applied ML/causal inference (or equivalent) with direct paid search/auction experience. Expert in causal methods (uplift modeling, DML, IV, DiD/synth control, BSTS/Bayesian time series) and experimental design . Strong software engineering: Python (pandas, numpy, scikit-learn, LightGBM/XGBoost), SQL; experience with Spark and one of AWS/GCP/Azure. Hands-on with A/B frameworks , power analysis, and measurement diagnostics (SRM, balance, interference). Proven track record integrating with Google Ads/Microsoft Ads/SA360 and moving the needle on tROAS, CPA, LTV. Clear communicator who can mentor senior ICs and partner with product/marketing. Nice to Have: Recsys, bandits/RL for bidding/budget pacing, MMM and privacy-aware attribution Scala/Java or microservices experience; Airflow/DBT; Kafka/PubSub; Feast or similar feature stores. Domain knowledge of auction theory, query taxonomy, brand vs. non-brand dynamics, and budget rebalancing Staff-Level Capabilities Technical leadership through influence rather than formal management authority Strategic thinking with the ability to balance long-term technical vision with immediate organizational needs Cross-functional collaboration skills to work effectively with Data Science, Product, and Engineering teams Communication skills to inject technical context into high-level organizational discussions Problem-solving approach for ambiguous, high-impact technical challenges Mentorship and sponsorship experience growing junior and mid-level engineers What We Offer: Accelerated Growth Environment: Immerse yourself in an environment designed for swift skill and knowledge enhancement, where you have the autonomy to lead experiments and tests on a massive scale. Top Tier Compensation Package: Enjoy a rewarding compensation package that includes enticing stock incentives, aligning with our commitment to recognizing and valuing your contributions. Flexible Time Off: Embrace a healthy work-life balance with unlimited Flex Time Off, providing you the flexibility to manage your schedule and recharge as needed. Comprehensive Benefits Package: Prioritize your well-being with a comprehensive benefits package, featuring 401k, and premium Health, Vision, and Dental Insurance options. The anticipated gross base pay range is below for this role. Actual compensation will vary depending on factors such as a candidate’s qualifications, skills, experience, and competencies. Base annual salary is one component of StubHub’s total compensation and competitive benefits package, which includes equity, 401(k), paid time off, paid parental leave, and comprehensive health benefits. Salary Range $300,000 - $350,000 USD About Us StubHub is the world’s leading marketplace to buy and sell tickets to any live event, anywhere. Through StubHub in North America and viagogo, our international platform, we service customers in 195 countries in 33 languages and 49 available currencies. With more than 300 million tickets available annually on our platform to events around the world -- from sports to music, comedy to dance, festivals to theater -- StubHub offers the safest, most convenient way to buy or sell tickets to the most memorable live experiences. Come join our team for a front-row seat to the action. For California Residents: California Job Applicant Privacy Notice found here We are an equal opportunity employer and value diversity on our team. We do not discriminate on the basis of race, color, religion, sex, national origin, gender, sexual orientation, age, disability, veteran status, or any other legally protected status.",Full Time
19,Staff Machine Learning Engineer - Acquisition Paid Search,StubHub,"$300,000","$350,000","Los Angeles, California, United States","StubHub is on a mission to redefine the live event experience on a global scale. Whether someone is looking to attend their first event or their hundredth, we’re here to delight them all the way from the moment they start looking for a ticket until they step through the gate. The same goes for our sellers. From fans selling a single ticket to the promoters of a worldwide stadium tour, we want StubHub to be the safest, most convenient way to offer a ticket to the millions of fans who browse our platform around the world. About the Opportunity We’re seeking a Staff Machine Learning Engineer to lead the science and systems that power our paid search marketing. You’ll design the causal measurement stack, ship models that influence bidding and budgeting in real time, and partner with marketing, data, and platform teams to drive profitable, incremental growth. StubHub is the largest secondary ticket market in the world, generating massive amounts of consumer data that are leveraged to tackle many unique and interesting predictive and inference problems across user acquisition, product recommendations, pricing optimization, ticket fulfillment mitigation, and business forecasting. The core challenge for our marketing efforts is acquire as many new customers as possible, efficiently, and at the right time in their customer journey, making it a complex and highly impactful domain. Location: Hybrid (3 days in office/2 days remote) – New York, NY or Santa Monica, CA or Aliso Viejo, CA What You'll Do: Own causal measurement for paid search : Stand up uplift/incrementality frameworks (e.g., doubly robust learners, causal forests, DML, IVs, synthetic control, DiD, BSTS) to quantify lift beyond correlation. Ship production models : Build and serve models that inform bids, budgets, and query-level targeting using signals like incremental CPA, tROAS, LTV, and heterogenous treatment effects. Design experiments & guardrails : Architect geo/cell tests and online experiments; handle power analysis, pre-trend checks, SUTVA threats, SRM detection, and sequential monitoring. Integrate with ad platforms : Translate science into APIs/feeds for Google Ads, Microsoft Advertising, and SA360; validate against auction dynamics and Quality Score mechanics. Data & MLOps leadership : Partner with platform teams to instrument events, build reliable feature stores and ETL (batch/stream), and establish monitoring for drift, bias, leakage, and attribution sanity. Mentor & influence : Provide technical leadership across science, engineering, and marketing; set standards for methodology, code quality, documentation, and reproducibility. Tell the story : Communicate trade-offs and impact to execs and non-technical partners; make the complex understandable and actionable. What You've Done: 8+ years in applied ML/causal inference (or equivalent) with direct paid search/auction experience. Expert in causal methods (uplift modeling, DML, IV, DiD/synth control, BSTS/Bayesian time series) and experimental design . Strong software engineering: Python (pandas, numpy, scikit-learn, LightGBM/XGBoost), SQL; experience with Spark and one of AWS/GCP/Azure. Hands-on with A/B frameworks , power analysis, and measurement diagnostics (SRM, balance, interference). Proven track record integrating with Google Ads/Microsoft Ads/SA360 and moving the needle on tROAS, CPA, LTV. Clear communicator who can mentor senior ICs and partner with product/marketing. Nice to Have: Recsys, bandits/RL for bidding/budget pacing, MMM and privacy-aware attribution Scala/Java or microservices experience; Airflow/DBT; Kafka/PubSub; Feast or similar feature stores. Domain knowledge of auction theory, query taxonomy, brand vs. non-brand dynamics, and budget rebalancing Staff-Level Capabilities Technical leadership through influence rather than formal management authority Strategic thinking with the ability to balance long-term technical vision with immediate organizational needs Cross-functional collaboration skills to work effectively with Data Science, Product, and Engineering teams Communication skills to inject technical context into high-level organizational discussions Problem-solving approach for ambiguous, high-impact technical challenges Mentorship and sponsorship experience growing junior and mid-level engineers What We Offer: Accelerated Growth Environment: Immerse yourself in an environment designed for swift skill and knowledge enhancement, where you have the autonomy to lead experiments and tests on a massive scale. Top Tier Compensation Package: Enjoy a rewarding compensation package that includes enticing stock incentives, aligning with our commitment to recognizing and valuing your contributions. Flexible Time Off: Embrace a healthy work-life balance with unlimited Flex Time Off, providing you the flexibility to manage your schedule and recharge as needed. Comprehensive Benefits Package: Prioritize your well-being with a comprehensive benefits package, featuring 401k, and premium Health, Vision, and Dental Insurance options. The anticipated gross base pay range is below for this role. Actual compensation will vary depending on factors such as a candidate’s qualifications, skills, experience, and competencies. Base annual salary is one component of StubHub’s total compensation and competitive benefits package, which includes equity, 401(k), paid time off, paid parental leave, and comprehensive health benefits. Salary Range $300,000 - $350,000 USD About Us StubHub is the world’s leading marketplace to buy and sell tickets to any live event, anywhere. Through StubHub in North America and viagogo, our international platform, we service customers in 195 countries in 33 languages and 49 available currencies. With more than 300 million tickets available annually on our platform to events around the world -- from sports to music, comedy to dance, festivals to theater -- StubHub offers the safest, most convenient way to buy or sell tickets to the most memorable live experiences. Come join our team for a front-row seat to the action. For California Residents: California Job Applicant Privacy Notice found here We are an equal opportunity employer and value diversity on our team. We do not discriminate on the basis of race, color, religion, sex, national origin, gender, sexual orientation, age, disability, veteran status, or any other legally protected status.",Full Time
